title,author,category
A Dungeons & Dragons actual play show is going to sell out Madison Square Garden | TechCrunch,Amanda Silberling,Unknown Category
Sample seed pitch deck: Xpanceo's $40M deck | TechCrunch,Haje Jan Kamps,Unknown Category
Lyrak to take on X by combining the best of Twitter with fediverse integration | TechCrunch,Sarah Perez,Unknown Category
"eBay enters trading card commercial agreement with Collectors, acquires Goldin | TechCrunch",Lauren Forristal,Unknown Category
Roku's Pro Series TVs are now available | TechCrunch,Lauren Forristal,Unknown Category
"I have a group chat with three AI friends, thanks to Nomi AI — they're getting too smart | TechCrunch",Amanda Silberling,Unknown Category
Meta (again) denies that Netflix read users' private Facebook messages | TechCrunch,Sarah Perez,Unknown Category
X confirms plans for NSFW Communities | TechCrunch,Sarah Perez,Unknown Category
India cuts import taxes on EVs in win for Tesla's entry plans | TechCrunch,Manish Singh,Unknown Category
Don Lemon says Elon Musk has canceled his deal for a show on X,Aisha Malik,Unknown Category
